{"$schema":"https://json-schema.org/draft/2020-12/schema","$id":"https://thedailyline.bet/schemas/video/v1/publishable-fact-package.schema.json","title":"PublishableFactPackage","type":"object","additionalProperties":false,"required":["schema_version","package_id","producer","producer_release","source_run_refs","created_at","valid_from","expires_at","sport","scope_ref","content_authority","recommendation_state","allowed_story_families","approved_claims","approved_facts","approved_explanations","presentation_hints","asset_restrictions","disclaimer_profile_ref","embargo_policy","provenance_manifest_ref","package_digest"],"properties":{"schema_version":{"const":"publishable-fact-package.v1"},"package_id":{"$ref":"common.schema.json#/$defs/Id"},"producer":{"$ref":"common.schema.json#/$defs/Ref"},"producer_release":{"$ref":"common.schema.json#/$defs/Ref"},"source_run_refs":{"$ref":"common.schema.json#/$defs/RefSet"},"created_at":{"$ref":"common.schema.json#/$defs/Timestamp"},"valid_from":{"$ref":"common.schema.json#/$defs/Timestamp"},"expires_at":{"$ref":"common.schema.json#/$defs/Timestamp"},"sport":{"type":"string","minLength":1,"maxLength":64},"scope_ref":{"$ref":"common.schema.json#/$defs/Ref"},"content_authority":{"$ref":"common.schema.json#/$defs/Ref"},"recommendation_state":{"type":"string","minLength":1,"maxLength":64},"allowed_story_families":{"$ref":"common.schema.json#/$defs/StringSet"},"approved_claims":{"type":"array","items":{"$ref":"#/$defs/ApprovedClaim"}},"approved_facts":{"type":"array","items":{"$ref":"#/$defs/ApprovedFact"}},"approved_explanations":{"type":"array","items":{"$ref":"#/$defs/ApprovedExplanation"}},"presentation_hints":{"type":"object"},"asset_restrictions":{"type":"object"},"disclaimer_profile_ref":{"$ref":"common.schema.json#/$defs/Ref"},"embargo_policy":{"type":"object"},"provenance_manifest_ref":{"$ref":"common.schema.json#/$defs/Ref"},"evaluation_set_ref":{"oneOf":[{"$ref":"common.schema.json#/$defs/Ref"},{"type":"null"}]},"supersedes_package_refs":{"$ref":"common.schema.json#/$defs/RefSet"},"package_digest":{"$ref":"common.schema.json#/$defs/Digest"}},"$defs":{"ApprovedFact":{"type":"object","additionalProperties":false,"required":["fact_id","kind","label","raw_value","formatted_value","precision_policy","source_ref","source_field_ref","as_of","valid_until","sensitivity","rendering_constraints"],"properties":{"fact_id":{"$ref":"common.schema.json#/$defs/Id"},"kind":{"type":"string","minLength":1},"label":{"type":"string","minLength":1},"raw_value":{"$ref":"common.schema.json#/$defs/Scalar"},"formatted_value":{"type":"string","minLength":1},"unit":{"type":["string","null"]},"precision_policy":{"$ref":"common.schema.json#/$defs/Ref"},"source_ref":{"$ref":"common.schema.json#/$defs/Ref"},"source_field_ref":{"$ref":"common.schema.json#/$defs/Ref"},"as_of":{"$ref":"common.schema.json#/$defs/Timestamp"},"valid_until":{"$ref":"common.schema.json#/$defs/Timestamp"},"sensitivity":{"type":"string","minLength":1},"rendering_constraints":{"type":"object"},"conflict_key":{"type":["string","null"]},"authority_revision":{"type":["string","null"]}}},"ApprovedClaim":{"type":"object","additionalProperties":false,"required":["claim_id","claim_type","text","fact_refs","source_ref","allowed_paraphrase","must_render_verbatim","valid_until","sensitivity"],"properties":{"claim_id":{"$ref":"common.schema.json#/$defs/Id"},"claim_type":{"type":"string","minLength":1},"text":{"type":"string","minLength":1},"fact_refs":{"$ref":"common.schema.json#/$defs/RefSet"},"source_ref":{"$ref":"common.schema.json#/$defs/Ref"},"allowed_paraphrase":{"type":"boolean"},"must_render_verbatim":{"type":"boolean"},"valid_until":{"$ref":"common.schema.json#/$defs/Timestamp"},"sensitivity":{"type":"string","minLength":1}}},"ApprovedExplanation":{"type":"object","additionalProperties":false,"required":["explanation_id","headline","body","supporting_fact_refs","reason_code","priority","allowed_paraphrase","valid_until"],"properties":{"explanation_id":{"$ref":"common.schema.json#/$defs/Id"},"headline":{"type":"string","minLength":1},"body":{"type":"string","minLength":1},"supporting_fact_refs":{"$ref":"common.schema.json#/$defs/RefSet"},"reason_code":{"type":"string","minLength":1},"priority":{"type":"integer","minimum":0,"maximum":1000},"allowed_paraphrase":{"type":"boolean"},"valid_until":{"$ref":"common.schema.json#/$defs/Timestamp"}}}}}
