{"schema_version":"publishable-fact-package.v1","package_id":"pfp.mlb.sf-lad.20260908.v1","producer":"daily-mlb","producer_release":"daily-mlb@2026.09.08.1","source_run_refs":["mlb-run-20260908-001"],"created_at":"2026-09-08T16:00:00Z","valid_from":"2026-09-08T16:00:00Z","expires_at":"2026-09-09T00:00:00Z","sport":"MLB","scope_ref":"mlb-game-sf-lad-20260908","content_authority":"daily-mlb/publishable-output.v1","recommendation_state":"PASS","allowed_story_families":["single_pick","model_explainer"],"approved_claims":[{"claim_id":"claim.model-edge","claim_type":"model_comparison","text":"The Daily Line model gives San Francisco a higher win probability than the current market implies.","fact_refs":["fact.market-prob","fact.model-prob"],"source_ref":"mlb-output:recommendation","allowed_paraphrase":true,"must_render_verbatim":false,"valid_until":"2026-09-08T23:30:00Z","sensitivity":"public"},{"claim_id":"claim.pick","claim_type":"recommendation","text":"The approved recommendation is San Francisco moneyline.","fact_refs":["fact.pick"],"source_ref":"mlb-output:recommendation","allowed_paraphrase":false,"must_render_verbatim":false,"valid_until":"2026-09-08T23:30:00Z","sensitivity":"public"}],"approved_facts":[{"fact_id":"fact.model-prob","kind":"probability","label":"Model Win Probability","raw_value":"0.618","formatted_value":"61.8%","unit":"percent","precision_policy":"probability-display.v1","source_ref":"mlb-output:model","source_field_ref":"prediction.home_or_away_probability","as_of":"2026-09-08T16:00:00Z","valid_until":"2026-09-08T23:30:00Z","sensitivity":"public","rendering_constraints":{"protect_sign":false},"conflict_key":"mlb-game-sf-lad-20260908:model_probability:SF","authority_revision":"1"},{"fact_id":"fact.market-prob","kind":"probability","label":"Market Implied Probability","raw_value":"0.542","formatted_value":"54.2%","unit":"percent","precision_policy":"probability-display.v1","source_ref":"mlb-output:market","source_field_ref":"market.no_vig_probability","as_of":"2026-09-08T16:00:00Z","valid_until":"2026-09-08T23:30:00Z","sensitivity":"public","rendering_constraints":{},"conflict_key":"mlb-game-sf-lad-20260908:market_probability:SF","authority_revision":"1"},{"fact_id":"fact.pick","kind":"generic_text_fact","label":"Recommendation","raw_value":"SF ML","formatted_value":"SF ML","unit":null,"precision_policy":"text-verbatim.v1","source_ref":"mlb-output:recommendation","source_field_ref":"recommendation.display","as_of":"2026-09-08T16:00:00Z","valid_until":"2026-09-08T23:30:00Z","sensitivity":"public","rendering_constraints":{"verbatim":true},"conflict_key":"mlb-game-sf-lad-20260908:recommendation","authority_revision":"1"}],"approved_explanations":[{"explanation_id":"explanation.model-vs-market","headline":"Model versus market","body":"The certified model probability is above the market-implied probability for San Francisco.","supporting_fact_refs":["fact.model-prob","fact.market-prob"],"reason_code":"MODEL_MARKET_GAP","priority":10,"allowed_paraphrase":true,"valid_until":"2026-09-08T23:30:00Z"}],"presentation_hints":{"preferred_hook_family":"curiosity","team_display":"San Francisco"},"asset_restrictions":{"identifiable_player_likeness":false},"disclaimer_profile_ref":"sports-betting-general.v1","embargo_policy":{"not_before":"2026-09-08T16:00:00Z"},"provenance_manifest_ref":"mlb-provenance-manifest:20260908-001","evaluation_set_ref":null,"supersedes_package_refs":[],"package_digest":"sha256:2abfa3c2a8c07afe7b60d5d7645c594a06ba87164c13252b0351dc9ba5d95c1a"}
